{
  "envelope_id": "env.repo_change_plan_run_v1",
  "verb": "transform",
  "resource": "code_change_plan",
  "input": {
    "repo_snapshot_md": "MOVA Skills Lab â€” MOVA 4.0.0 contract-first monorepo (core/mova, skills/, lab/, docs/, spec/mova-4.1.0-draft as reference).",
    "goal_summary": "Add minimal lab battery passport: schema lab/schemas/ds.lab_battery_passport_minimal_v1.schema.json and example lab/examples/dpp_battery_passport_minimal_example.json. Then run npm test and take a snapshot dpp_after_L1_02_battery_passport_minimal. Do not touch core/mova or spec/4.1.0-draft.",
    "change_kind_hint": "infra_change",
    "must_not_touch": [
      "core/mova/**",
      "spec/mova-4.1.0-draft/**"
    ],
    "preferred_areas": [
      "lab/schemas/**",
      "lab/examples/**",
      "lab/skill_runs/**",
      "docs/PROJECT_MEMORY/**",
      "skills/repo_snapshot_basic/episodes/**",
      "skills/repo_code_change_plan_basic/episodes/**"
    ],
    "constraints_md": "Keep to lab-level schema+example, reuse existing snapshot patterns, no changes to core/spec."
  },
  "meta": {
    "language": "en",
    "labels": [
      "dpp_lab",
      "L1_02_battery_passport_minimal"
    ]
  }
}
