{
  "envelope_id": "env.repo_change_plan_run_v1",
  "verb": "transform",
  "resource": "code_change_plan",
  "input": {
    "repo_snapshot_md": "MOVA Skills Lab â€” MOVA 4.0.0 contract-first monorepo (core/mova, skills/, lab/, docs/, spec/mova-4.1.0-draft as reference).",
    "goal_summary": "Add lab battery passport extended schema and example, update mova_check_basic examples/runs, run mova_check_basic, and capture a new snapshot (L1_06).",
    "change_kind_hint": "infra_change",
    "must_not_touch": [
      "core/mova/**",
      "spec/mova-4.1.0-draft/**"
    ],
    "preferred_areas": [
      "lab/schemas/**",
      "lab/examples/**",
      "lab/skill_runs/**",
      "skills/mova_check_basic/**",
      "skills/repo_snapshot_basic/episodes/**",
      "docs/PROJECT_MEMORY/**"
    ],
    "constraints_md": "All text in English, lab-level only, reuse existing snapshot/check patterns."
  },
  "meta": {
    "language": "en",
    "labels": [
      "dpp_lab",
      "L1_06_battery_passport_extended"
    ]
  }
}
