{
  "envelope_id": "env.repo_change_plan_run_v1",
  "verb": "transform",
  "resource": "code_change_plan",
  "input": {
    "repo_snapshot_md": "# MOVA Skills Lab (2025-12-10)\n\n- Red core: `core/mova` MOVA 4.0.0 contracts (unchanged).\n- Yellow layer: infra skills validated via npm test.\n- Green layer: lab workflow schemas/envelopes (WF_LAB_01), baseline/candidate artifacts for WF-EX-001 through WF_LAB_04 with snapshots.\n- Goal: add Codex-only candidate workflow, record run data + run envelope, produce baseline vs codex experiment result, validate via mova_check_basic, snapshot WF_LAB_05.",
    "goal_summary": "WF_LAB_05 â€” add candidate codex_only procedure and run artifacts, create baseline vs codex experiment result, validate, and snapshot.",
    "change_kind_hint": "infra_change",
    "must_not_touch": [
      "core/mova/**"
    ],
    "preferred_areas": [
      "lab/examples/**",
      "lab/skill_runs/**",
      "skills/**/episodes/**",
      "docs/PROJECT_MEMORY/**"
    ],
    "constraints_md": "Stay in lab layer, keep MOVA 4.0.0 compatibility, ensure checker passes, snapshot after artifacts ready.",
    "initial_files_of_interest": [
      {
        "path": "lab/examples/ds.lab_workflow_procedure_v1.WF_EX_001_baseline_repo_change_plan.json",
        "reason": "Reference baseline procedure."
      },
      {
        "path": "lab/examples/ds.lab_workflow_experiment_config_v1.WF_EX_001_repo_change_plan_vs_agents.json",
        "reason": "Experiment config with codex_only profile."
      }
    ]
  },
  "meta": {
    "project_id": "mova_skills_lab",
    "labels": [
      "WF_LAB_05",
      "WF_EX_001",
      "lab_workflow"
    ],
    "domain": "lab_workflow",
    "requested_at": "2025-12-10T00:00:00Z"
  }
}
