{
  "envelope_id": "env.repo_change_plan_run_v1",
  "verb": "transform",
  "resource": "code_change_plan",
  "input": {
    "repo_snapshot_md": "MOVA Skills Lab â€” MOVA 4.0.0 contract-first monorepo (core/mova, skills/, lab/, docs/, spec/mova-4.1.0-draft as reference).",
    "goal_summary": "Wire skill.mova_check_basic into the skills registry with an LLM binding and run the first real validation for ds.lab_battery_passport_minimal_v1. Capture result and episode.",
    "change_kind_hint": "infra_change",
    "must_not_touch": [
      "core/mova/**",
      "spec/mova-4.1.0-draft/**"
    ],
    "preferred_areas": [
      "lab/skills_registry_v1.json",
      "skills/mova_check_basic/**",
      "lab/examples/**",
      "lab/skill_runs/**",
      "skills/repo_snapshot_basic/episodes/**",
      "skills/mova_check_basic/episodes/**",
      "docs/PROJECT_MEMORY/**"
    ],
    "constraints_md": "Use existing LLM-profile pattern, keep everything in English, no changes to core/spec."
  },
  "meta": {
    "language": "en",
    "labels": [
      "dpp_lab",
      "L1_04_mova_check_binding"
    ]
  }
}
