{
  "envelope_id": "env.repo_change_plan_run_v1",
  "verb": "transform",
  "resource": "code_change_plan",
  "input": {
    "repo_snapshot_md": "# MOVA Skills Lab (2025-12-10)\n\n- Red core: `core/mova` MOVA 4.0.0 contracts (unchanged).\n- Yellow layer: infra skills validated via npm test.\n- Green layer: lab workflow schemas/envelopes with WF-EX-001 artifacts and snapshots through WF_LAB_05.\n- Goal now: introduce WF-EX-002 SmartLink baseline/candidate, configs, plan envelope, validation, and snapshot.",
    "goal_summary": "WF_LAB_06 â€” set up WF-EX-002 SmartLink: baseline procedure, experiment config, plan envelope example, mova_check, snapshot.",
    "change_kind_hint": "infra_change",
    "must_not_touch": [
      "core/mova/**"
    ],
    "preferred_areas": [
      "lab/examples/**",
      "lab/skill_runs/**",
      "skills/**/episodes/**",
      "docs/PROJECT_MEMORY/**"
    ],
    "constraints_md": "Stay in lab green layer; keep MOVA 4.0.0 compatibility; ensure checker passes; snapshot after artifacts ready.",
    "initial_files_of_interest": [
      {
        "path": "schemas/lab/ds.lab_workflow_procedure_v1.schema.json",
        "reason": "For SmartLink baseline/candidate procedures."
      },
      {
        "path": "schemas/lab/ds.lab_workflow_experiment_config_v1.schema.json",
        "reason": "For WF-EX-002 experiment config."
      },
      {
        "path": "envelopes/lab/env.lab_workflow_experiment_plan_request_v1.schema.json",
        "reason": "For plan envelope example."
      }
    ]
  },
  "meta": {
    "project_id": "mova_skills_lab",
    "labels": [
      "WF_LAB_06",
      "WF_EX_002",
      "lab_workflow",
      "smartlink"
    ],
    "domain": "lab_workflow",
    "requested_at": "2025-12-10T14:00:00Z"
  }
}
