{
  "envelope_id": "env.repo_change_plan_run_v1",
  "verb": "transform",
  "resource": "code_change_plan",
  "input": {
    "repo_snapshot_md": "MOVA Skills Lab â€” MOVA 4.0.0 contract-first monorepo (core/mova, skills/, lab/, docs/, spec/mova-4.1.0-draft as reference).",
    "goal_summary": "Introduce DECISIONS_DPP_LAB.md decision log; record deferred items: cobalt-only materials model in extended passport; external_sources optional in extended passport.",
    "change_kind_hint": "infra_change",
    "must_not_touch": [
      "core/mova/**",
      "spec/mova-4.1.0-draft/**"
    ],
    "preferred_areas": [
      "docs/PROJECT_MEMORY/**",
      "lab/examples/**",
      "lab/skill_runs/**",
      "skills/repo_code_change_plan_basic/episodes/**",
      "skills/repo_snapshot_basic/episodes/**"
    ],
    "constraints_md": "All text in English; add decision log; keep lab-level artifacts only."
  },
  "meta": {
    "language": "en",
    "labels": [
      "dpp_lab",
      "L1_07_decisions_deferred"
    ]
  }
}
