{
  "envelope_id": "env.repo_change_plan_run_v1",
  "verb": "transform",
  "resource": "code_change_plan",
  "input": {
    "repo_snapshot_md": "# MOVA Skills Lab (2025-12-10)\n\n- Red core: `core/mova` MOVA 4.0.0 contracts (unchanged).\n- Yellow layer: infra skills and bindings validated via npm test.\n- Green layer: lab workflow schemas/envelopes added (WF_LAB_01), WF-EX-001 baseline artifacts and run examples recorded (WF_LAB_02/03).\n- Current goal: add metrics to baseline run, produce baseline-only experiment result, aggregate envelope example, validate via mova_check_basic, snapshot WF_LAB_04.",
    "goal_summary": "WF_LAB_04 â€” enrich baseline run with metrics, create baseline-only experiment result and aggregate envelope, validate with mova_check_basic, snapshot WF_LAB_04.",
    "change_kind_hint": "infra_change",
    "must_not_touch": [
      "core/mova/**"
    ],
    "preferred_areas": [
      "lab/examples/**",
      "lab/skill_runs/**",
      "skills/**/episodes/**",
      "docs/PROJECT_MEMORY/**"
    ],
    "constraints_md": "Stay in lab green layer; keep MOVA 4.0.0 compatibility; ensure checker passes; snapshot after artifacts ready.",
    "initial_files_of_interest": [
      {
        "path": "lab/examples/ds.lab_workflow_episode_data_v1.WF_EX_001_baseline_repo_change_plan_run_01.json",
        "reason": "Add metrics to baseline run data."
      },
      {
        "path": "schemas/lab/ds.lab_workflow_experiment_result_v1.schema.json",
        "reason": "For baseline-only experiment result."
      },
      {
        "path": "envelopes/lab/env.lab_workflow_experiment_aggregate_request_v1.schema.json",
        "reason": "Aggregate envelope example."
      }
    ]
  },
  "meta": {
    "project_id": "mova_skills_lab",
    "labels": [
      "WF_LAB_04",
      "WF_EX_001",
      "lab_workflow"
    ],
    "domain": "lab_workflow",
    "requested_at": "2025-12-10T00:00:00Z"
  }
}
