{
  "envelope_id": "env.repo_change_plan_run_v1",
  "verb": "transform",
  "resource": "code_change_plan",
  "input": {
    "repo_snapshot_md": "MOVA Skills Lab — MOVA 4.0.0 contract-first monorepo (core/mova, skills/, lab/, docs/, spec/mova-4.1.0-draft as reference).",
    "goal_summary": "Add lab workflow normalize→export→verifier using existing DPP envelopes; add export/read examples from normalized passport; capture snapshot and refresh SQLite memory.",
    "change_kind_hint": "infra_change",
    "must_not_touch": [
      "core/mova/**",
      "spec/mova-4.1.0-draft/**"
    ],
    "preferred_areas": [
      "lab/examples/**",
      "lab/skill_runs/**",
      "skills/repo_snapshot_basic/episodes/**",
      "docs/PROJECT_MEMORY/**",
      "lab/memory/**"
    ],
    "constraints_md": "All text in English; lab-level only; reuse existing envelopes from L2_01/L2_02/L3_02; keep passport_id consistent (BAT-2025-NORM-001)."
  },
  "meta": {
    "language": "en",
    "labels": [
      "dpp_lab",
      "L3_03",
      "normalize_export_verifier_workflow"
    ]
  }
}
