{
  "envelope_id": "env.repo_change_plan_run_v1",
  "verb": "transform",
  "resource": "code_change_plan",
  "input": {
    "repo_snapshot_md": "MOVA Skills Lab â€” MOVA 4.0.0 contract-first monorepo (core/mova, skills/, lab/, docs/, spec/mova-4.1.0-draft as reference).",
    "goal_summary": "Add env.dpp_passport_read_v1 (lab envelope) with public/manufacturer/verifier examples, validate via mova_check_basic, and capture L2_01 snapshot.",
    "change_kind_hint": "infra_change",
    "must_not_touch": [
      "core/mova/**",
      "spec/mova-4.1.0-draft/**"
    ],
    "preferred_areas": [
      "lab/env/**",
      "lab/examples/**",
      "lab/skill_runs/**",
      "skills/mova_check_basic/**",
      "skills/repo_snapshot_basic/episodes/**",
      "docs/PROJECT_MEMORY/**",
      "lab/memory/**"
    ],
    "constraints_md": "All text in English; lab-level only; reuse existing mova_check_basic and repo_snapshot_basic patterns; keep passport examples consistent with extended passport."
  },
  "meta": {
    "language": "en",
    "labels": [
      "dpp_lab",
      "L2_01_dpp_passport_read_workflow"
    ]
  }
}
